timestamp,type,rating,name,email,message
"2026-06-12T08:14:39.615Z","General Feedback","5","Piyush","techoreon@gmail.com","Good tool indeed."
"2026-06-12T08:16:07.191Z","General Feedback","5","Piyush","techoreon@gmail.com","woah"
"2026-06-12T08:57:16.240Z","Feature Request","4","Guptos","piyushguptos0503@gmail.com","The extension's impressive and very handy overall, can you add shortcuts to pin and close the windows too? That'd be great."
"2026-06-19T16:31:05.740Z","Bug Report","4","","gallop.rider@outlook.jp","Hello, thank you for this wonderful extension!  Please fix the issue where the window size minimizes."
"2026-06-21T14:07:26.867Z","General Feedback","4","Projekta2","hello@projekta2.com","This matches something I've noticed building a tool around idle tab behavior: the visual feedback loop is doing more work than people realize. When tabs look ""organized"" (grouped, collapsed, whatever), the discomfort that used to make you close things disappears — but the underlying cost (RAM, attention, whatever metric you care about) doesn't move at all.  What's interesting is that this isn't really about tab groups specifically — it's that any UI that hides quantity without reducing it removes the feedback signal that drove the original behavior change. Same pattern shows up in inbox folders, Slack channel muting, anything where ""out of sight"" gets mistaken for ""resolved.""  The fix that's actually worked for people I've talked to isn't a better organization system, it's reintroducing a cost signal — something that makes the accumulation visible again instead of invisible."
